No.     Time           Source                Destination           Protocol Length Info
      1 0.000000       193.232.148.43        192.168.1.40          TCP      1466   8000 → 49171 [ACK] Seq=1 Ack=1 Win=66 Len=1412

Frame 1: 1466 bytes on wire (11728 bits), 1466 bytes captured (11728 bits) on interface \Device\NPF_{F7DAFAAD-B29B-4F7A-9C1C-178E8F509E7C}, id 0
Ethernet II, Src: HuaweiDe_f1:38:e1 (24:6f:8c:f1:38:e1), Dst: ASRockIn_9a:ab:d8 (a8:a1:59:9a:ab:d8)
Internet Protocol Version 4, Src: 193.232.148.43, Dst: 192.168.1.40
Transmission Control Protocol, Src Port: 8000, Dst Port: 49171, Seq: 1, Ack: 1, Len: 1412
Data (1412 bytes)

0000  44 53 7a 60 db af 0e ce 9e 77 b1 97 dc ec 52 7e   DSz`.....w....R~
0010  e8 11 08 c7 a0 73 5a 62 26 dc a7 d4 80 f8 d6 cb   .....sZb&.......
0020  9b 2e 95 17 58 95 3b db e9 9c a7 ed 1f 91 4f 39   ....X.;.......O9
0030  18 ce 4b 28 ad 07 db 2e d3 b9 03 4c c4 94 3d ac   ..K(.......L..=.
0040  d1 39 b2 9e 43 4e c0 d6 bd 2b a7 3f 16 bc 60 6a   .9..CN...+.?..`j
0050  80 2e 55 4e b7 7a d3 c7 bf 35 cb 82 d5 1f a9 e3   ..UN.z...5......
0060  f4 82 d5 b0 12 86 9b c1 2f da 2d 27 5c b0 52 1e   ......../.-'\.R.
0070  6e bd f6 ca 98 b1 45 ed 30 96 aa 7e 7d 0b 2d d5   n.....E.0..~}.-.
0080  97 94 29 b0 3c c1 94 a2 62 f5 16 5b b9 c6 0e 3d   ..).<...b..[...=
0090  22 89 0a 87 ca 73 ca 49 6d c1 7a be 87 37 ce e3   "....s.Im.z..7..
00a0  11 70 e7 92 19 61 ad 4b b2 e9 1d f4 93 c7 22 ac   .p...a.K......".
00b0  3e 14 4a 56 d3 3b 09 40 6c 6c af fa b7 5d f5 ac   >.JV.;.@ll...]..
00c0  25 d1 ed f8 c9 18 97 7d 9c 01 03 ba c8 dd c3 e5   %......}........
00d0  a7 e4 5d 63 45 b2 a9 08 ac f0 32 ba 0e 2a 4e af   ..]cE.....2..*N.
00e0  e0 6c b7 84 98 0a 00 b9 26 62 f5 b0 f8 c5 98 ce   .l......&b......
00f0  a4 08 62 7f 34 f2 f6 5f 02 ad c9 c9 07 51 a9 cb   ..b.4.._.....Q..
0100  c6 e2 d2 dc 0e 0d 5d b8 f3 74 12 49 ff 66 3d 06   ......]..t.I.f=.
0110  b0 9f 18 88 84 83 5c d5 45 79 ac 8e 79 49 9d fd   ......\.Ey..yI..
0120  7b 0f c4 4a de 38 b5 96 89 f4 e8 12 5b 71 d8 9b   {..J.8......[q..
0130  09 cf c0 63 ec ce 87 3a 92 5b 68 2a de d3 f6 b1   ...c...:.[h*....
0140  9d 7b aa a4 4e 5a 19 68 40 f5 60 27 a4 5d 8f 11   .{..NZ.h@.`'.]..
0150  1a 08 89 17 b6 d5 89 66 bc 7a 32 50 2a c1 f5 22   .......f.z2P*.."
0160  d5 92 66 ec 0b 78 d5 6e 11 1d e0 8d 04 99 ca a5   ..f..x.n........
0170  28 ed c0 e6 bc cb 07 5c a5 75 96 34 52 4e 64 58   (......\.u.4RNdX
0180  6f 12 79 3e 42 2c e5 eb 91 77 94 4e 0c c4 f7 3d   o.y>B,...w.N...=
0190  53 d5 f8 cb 81 69 50 23 cc 27 7c 03 01 2a 9b dc   S....iP#.'|..*..
01a0  e6 9c 31 33 f5 a5 8a 4a bd 29 16 33 3f b2 d0 81   ..13...J.).3?...
01b0  ab 43 66 5d 13 87 3a 7f 15 3f 18 f0 d5 3e 41 35   .Cf]..:..?...>A5
01c0  9c e3 27 93 cb 1d 20 94 70 de fa bf 03 fc 5a bb   ..'... .p.....Z.
01d0  d5 d2 56 9f 50 ed d5 8d e9 6b 8c cd 1d 28 0d db   ..V.P....k...(..
01e0  17 d3 de f0 36 16 49 8f aa dc 86 aa 54 04 e4 14   ....6.I.....T...
01f0  75 d4 4e 63 76 61 55 3c 1c 3b 7f 30 b3 bd 8a 22   u.NcvaU<.;.0..."
0200  3b 9d c1 d7 ff e0 db ce 8c c1 69 95 7b 0c 9e d0   ;.........i.{...
0210  25 f5 4d e0 1f 53 7a 33 b2 09 1e 5c cf 5b ab 49   %.M..Sz3...\.[.I
0220  bb 04 67 da 4a bf 3e 95 5e a9 cb f6 58 b4 dc d7   ..g.J.>.^...X...
0230  0e ff 07 4e 15 4d 2c 43 de 6c 33 9c d3 61 30 11   ...N.M,C.l3..a0.
0240  2a 3e 96 2d c9 51 6b 42 1a 5b dd 72 a0 49 95 0b   *>.-.QkB.[.r.I..
0250  2b f3 d7 15 7c 6f bc a1 c9 80 bc 49 b3 47 a2 ef   +...|o.....I.G..
0260  37 c9 44 fa 9f ac b3 d3 72 0a 10 b9 28 48 97 a4   7.D.....r...(H..
0270  45 fc 9a 79 46 48 0f 5a 7b 87 f2 41 6f 83 fe fb   E..yFH.Z{..Ao...
0280  b9 3d bd cd 15 39 56 2c 20 b9 2c 6b 41 d4 ed b7   .=...9V, .,kA...
0290  79 b7 f7 b0 78 f8 59 57 02 84 30 90 4d 4e 1a 81   y...x.YW..0.MN..
02a0  0e 81 ab be 1d 44 26 50 17 d2 39 f2 43 a6 26 7e   .....D&P..9.C.&~
02b0  f3 e4 f6 15 17 60 98 87 8a 48 38 94 25 58 6a af   .....`...H8.%Xj.
02c0  34 b8 1f 19 a8 3b 25 48 79 24 2d 6e 15 a1 09 d2   4....;%Hy$-n....
02d0  59 35 3f 4c ae da 51 15 37 a6 0c 23 f3 a1 1c 2b   Y5?L..Q.7..#...+
02e0  cd c0 86 30 ff d0 0a 26 30 0a 80 65 b1 88 71 b9   ...0...&0..e..q.
02f0  2d f0 84 ae f7 74 34 97 85 08 9e 4e 19 5b d2 28   -....t4....N.[.(
0300  99 f7 c0 a4 aa af 1c 21 bd 39 17 cd b4 94 7b 53   .......!.9....{S
0310  bf d1 5c ff d2 71 c1 3f 2f 71 ce 2e 14 36 85 08   ..\..q.?/q...6..
0320  f2 4e bc a3 e4 b8 d8 a6 97 76 18 bc 4a 13 86 30   .N.......v..J..0
0330  18 01 7d ce 76 43 cd b0 1d c7 8c 35 64 8e 3c 32   ..}.vC.....5d.<2
0340  95 00 db 20 e2 95 13 60 24 ce 12 f3 fe af 6b 1e   ... ...`$.....k.
0350  0d 02 86 12 41 0e d8 12 75 8a 42 05 c7 c5 85 45   ....A...u.B....E
0360  cd bd d1 80 78 a7 df f6 77 f2 5a e7 a5 d4 3f 07   ....x...w.Z...?.
0370  5b 52 f8 c8 74 e0 9d 78 8a 92 4a 87 f1 c8 0d 06   [R..t..x..J.....
0380  ff ab ae 7d f4 e7 a0 4c 25 02 42 8a 72 aa 59 bf   ...}...L%.B.r.Y.
0390  09 13 df 8f c0 aa 05 75 bf f5 a5 6a 7c 32 35 96   .......u...j|25.
03a0  45 50 2e 9c ed 25 22 48 0c 86 16 5a c4 9b b3 fa   EP...%"H...Z....
03b0  f8 66 94 33 05 83 27 e6 d7 f3 bc 46 1b 91 3f 17   .f.3..'....F..?.
03c0  fa f5 a3 fd d2 1a 77 7f 8e cc 4f 6e a4 a7 d5 84   ......w...On....
03d0  a7 fe 01 4b cb 4f 78 5e 36 9d 55 bc 43 63 2c 02   ...K.Ox^6.U.Cc,.
03e0  e6 dc 8a 2b 61 85 5e 7d 2f 8c c1 a3 7c 79 f7 f9   ...+a.^}/...|y..
03f0  79 25 80 e2 0f 6e 8f 0b 7c 58 c9 21 05 71 e8 7b   y%...n..|X.!.q.{
0400  ae 98 e1 8c ce 5a 79 df c1 41 9a 84 5f 0d 14 28   .....Zy..A.._..(
0410  27 eb 09 1b 14 d3 a7 ea 05 4f 5d 61 6b 12 00 e2   '........O]ak...
0420  b0 00 a4 90 2c a2 25 87 d4 e6 d8 28 35 3d 0a 92   ....,.%....(5=..
0430  73 05 57 37 ec 92 77 0a 60 cc ed 94 a1 af 6e 65   s.W7..w.`.....ne
0440  7c 1a 7a a3 5a 1f c0 50 1b a0 36 ab 3a 3d c1 3e   |.z.Z..P..6.:=.>
0450  4c 5f 6f a4 aa 26 03 3c 96 f2 b1 95 0c e4 4c 2f   L_o..&.<......L/
0460  a5 53 1c b8 f2 d3 00 50 42 60 a6 f7 67 01 70 23   .S.....PB`..g.p#
0470  19 8c bf da 28 8d 3b c6 cb 40 49 38 f4 d1 00 da   ....(.;..@I8....
0480  78 70 19 75 ce 8d 1c 01 be 79 f4 03 bf 4a e9 e0   xp.u.....y...J..
0490  46 83 6f f1 13 39 e7 58 f6 a2 45 d2 e5 b4 db 5f   F.o..9.X..E...._
04a0  08 e7 e9 57 02 87 49 58 41 80 2a f2 67 5e ba 83   ...W..IXA.*.g^..
04b0  1b 77 6c 06 f8 a0 a3 a1 25 6c d5 7e ff e4 14 fa   .wl.....%l.~....
04c0  42 d3 ec 35 23 fe 3a d9 f8 00 83 9c 6e 65 cd 0e   B..5#.:.....ne..
04d0  d2 a5 de 9e 8a 9e cc 7d 41 ea b8 25 fd d9 14 2f   .......}A..%.../
04e0  4b 04 ed a2 d2 05 02 57 93 2b 98 b1 cb ef 6a c7   K......W.+....j.
04f0  50 92 b2 b2 e8 d9 7c bd 2e ea 9f 90 f5 5c 4a 08   P.....|......\J.
0500  fa 65 f7 30 11 c6 f2 d7 03 a4 2e bb 95 20 31 2b   .e.0......... 1+
0510  76 fc c9 21 52 48 cb 3d c5 58 7c cd 33 9f ca 39   v..!RH.=.X|.3..9
0520  13 61 b9 fa 7a f2 8c b2 fc 92 75 56 3d 5e 6c da   .a..z.....uV=^l.
0530  6f d0 89 41 05 c9 8c 72 5f a7 b5 cd 24 22 48 d1   o..A...r_...$"H.
0540  d4 27 a4 24 5e 8d b6 29 7d e4 b9 19 d8 7b 17 b9   .'.$^..)}....{..
0550  31 e1 b3 a7 f1 fa c7 27 52 39 12 b5 39 53 fe b1   1......'R9..9S..
0560  18 94 7d 69 6f a0 c0 b8 c3 54 30 d8 af d9 c6 f3   ..}io....T0.....
0570  d0 f6 d0 55 d5 1a 18 f3 e3 32 5d c4 17 03 03 06   ...U.....2].....
0580  99 31 ce 9d                                       .1..

No.     Time           Source                Destination           Protocol Length Info
      2 0.000052       193.232.148.43        192.168.1.40          TLSv1.2  1466   Ignored Unknown Record

Frame 2: 1466 bytes on wire (11728 bits), 1466 bytes captured (11728 bits) on interface \Device\NPF_{F7DAFAAD-B29B-4F7A-9C1C-178E8F509E7C}, id 0
Ethernet II, Src: HuaweiDe_f1:38:e1 (24:6f:8c:f1:38:e1), Dst: ASRockIn_9a:ab:d8 (a8:a1:59:9a:ab:d8)
Internet Protocol Version 4, Src: 193.232.148.43, Dst: 192.168.1.40
Transmission Control Protocol, Src Port: 8000, Dst Port: 49171, Seq: 1413, Ack: 1, Len: 1412
Transport Layer Security

No.     Time           Source                Destination           Protocol Length Info
      3 0.000065       192.168.1.40          193.232.148.43        TCP      54     49171 → 8000 [ACK] Seq=1 Ack=2825 Win=1025 Len=0

Frame 3: 54 bytes on wire (432 bits), 54 bytes captured (432 bits) on interface \Device\NPF_{F7DAFAAD-B29B-4F7A-9C1C-178E8F509E7C}, id 0
Ethernet II, Src: ASRockIn_9a:ab:d8 (a8:a1:59:9a:ab:d8), Dst: HuaweiDe_f1:38:e1 (24:6f:8c:f1:38:e1)
Internet Protocol Version 4, Src: 192.168.1.40, Dst: 193.232.148.43
Transmission Control Protocol, Src Port: 49171, Dst Port: 8000, Seq: 1, Ack: 2825, Len: 0

No.     Time           Source                Destination           Protocol Length Info
      4 0.001286       192.168.1.40          77.88.55.55           TCP      55     57763 → 443 [ACK] Seq=1 Ack=1 Win=2047 Len=1 [TCP segment of a reassembled PDU]

Frame 4: 55 bytes on wire (440 bits), 55 bytes captured (440 bits) on interface \Device\NPF_{F7DAFAAD-B29B-4F7A-9C1C-178E8F509E7C}, id 0
Ethernet II, Src: ASRockIn_9a:ab:d8 (a8:a1:59:9a:ab:d8), Dst: HuaweiDe_f1:38:e1 (24:6f:8c:f1:38:e1)
Internet Protocol Version 4, Src: 192.168.1.40, Dst: 77.88.55.55
Transmission Control Protocol, Src Port: 57763, Dst Port: 443, Seq: 1, Ack: 1, Len: 1

No.     Time           Source                Destination           Protocol Length Info
      5 0.025803       77.88.55.55           192.168.1.40          TCP      66     443 → 57763 [ACK] Seq=1 Ack=2 Win=9600 Len=0 SLE=1 SRE=2

Frame 5: 66 bytes on wire (528 bits), 66 bytes captured (528 bits) on interface \Device\NPF_{F7DAFAAD-B29B-4F7A-9C1C-178E8F509E7C}, id 0
Ethernet II, Src: HuaweiDe_f1:38:e1 (24:6f:8c:f1:38:e1), Dst: ASRockIn_9a:ab:d8 (a8:a1:59:9a:ab:d8)
Internet Protocol Version 4, Src: 77.88.55.55, Dst: 192.168.1.40
Transmission Control Protocol, Src Port: 443, Dst Port: 57763, Seq: 1, Ack: 2, Len: 0

No.     Time           Source                Destination           Protocol Length Info
      6 0.035691       193.232.148.43        192.168.1.40          TLSv1.2  1466   Ignored Unknown Record

Frame 6: 1466 bytes on wire (11728 bits), 1466 bytes captured (11728 bits) on interface \Device\NPF_{F7DAFAAD-B29B-4F7A-9C1C-178E8F509E7C}, id 0
Ethernet II, Src: HuaweiDe_f1:38:e1 (24:6f:8c:f1:38:e1), Dst: ASRockIn_9a:ab:d8 (a8:a1:59:9a:ab:d8)
Internet Protocol Version 4, Src: 193.232.148.43, Dst: 192.168.1.40
Transmission Control Protocol, Src Port: 8000, Dst Port: 49171, Seq: 2825, Ack: 1, Len: 1412
Transport Layer Security

No.     Time           Source                Destination           Protocol Length Info
      7 0.067953       193.232.148.43        192.168.1.40          TLSv1.2  1466   Ignored Unknown Record

Frame 7: 1466 bytes on wire (11728 bits), 1466 bytes captured (11728 bits) on interface \Device\NPF_{F7DAFAAD-B29B-4F7A-9C1C-178E8F509E7C}, id 0
Ethernet II, Src: HuaweiDe_f1:38:e1 (24:6f:8c:f1:38:e1), Dst: ASRockIn_9a:ab:d8 (a8:a1:59:9a:ab:d8)
Internet Protocol Version 4, Src: 193.232.148.43, Dst: 192.168.1.40
Transmission Control Protocol, Src Port: 8000, Dst Port: 49171, Seq: 4237, Ack: 1, Len: 1412
Transport Layer Security

No.     Time           Source                Destination           Protocol Length Info
      8 0.067986       192.168.1.40          193.232.148.43        TCP      54     49171 → 8000 [ACK] Seq=1 Ack=5649 Win=1025 Len=0

Frame 8: 54 bytes on wire (432 bits), 54 bytes captured (432 bits) on interface \Device\NPF_{F7DAFAAD-B29B-4F7A-9C1C-178E8F509E7C}, id 0
Ethernet II, Src: ASRockIn_9a:ab:d8 (a8:a1:59:9a:ab:d8), Dst: HuaweiDe_f1:38:e1 (24:6f:8c:f1:38:e1)
Internet Protocol Version 4, Src: 192.168.1.40, Dst: 193.232.148.43
Transmission Control Protocol, Src Port: 49171, Dst Port: 8000, Seq: 1, Ack: 5649, Len: 0

No.     Time           Source                Destination           Protocol Length Info
      9 0.094228       193.232.148.43        192.168.1.40          TLSv1.2  1466   Ignored Unknown Record

Frame 9: 1466 bytes on wire (11728 bits), 1466 bytes captured (11728 bits) on interface \Device\NPF_{F7DAFAAD-B29B-4F7A-9C1C-178E8F509E7C}, id 0
Ethernet II, Src: HuaweiDe_f1:38:e1 (24:6f:8c:f1:38:e1), Dst: ASRockIn_9a:ab:d8 (a8:a1:59:9a:ab:d8)
Internet Protocol Version 4, Src: 193.232.148.43, Dst: 192.168.1.40
Transmission Control Protocol, Src Port: 8000, Dst Port: 49171, Seq: 5649, Ack: 1, Len: 1412
Transport Layer Security

No.     Time           Source                Destination           Protocol Length Info
     10 0.141292       192.168.1.40          193.232.148.43        TCP      54     49171 → 8000 [ACK] Seq=1 Ack=7061 Win=1025 Len=0

Frame 10: 54 bytes on wire (432 bits), 54 bytes captured (432 bits) on interface \Device\NPF_{F7DAFAAD-B29B-4F7A-9C1C-178E8F509E7C}, id 0
Ethernet II, Src: ASRockIn_9a:ab:d8 (a8:a1:59:9a:ab:d8), Dst: HuaweiDe_f1:38:e1 (24:6f:8c:f1:38:e1)
Internet Protocol Version 4, Src: 192.168.1.40, Dst: 193.232.148.43
Transmission Control Protocol, Src Port: 49171, Dst Port: 8000, Seq: 1, Ack: 7061, Len: 0

No.     Time           Source                Destination           Protocol Length Info
     11 0.173144       193.232.148.43        192.168.1.40          TLSv1.2  1466   Ignored Unknown Record

Frame 11: 1466 bytes on wire (11728 bits), 1466 bytes captured (11728 bits) on interface \Device\NPF_{F7DAFAAD-B29B-4F7A-9C1C-178E8F509E7C}, id 0
Ethernet II, Src: HuaweiDe_f1:38:e1 (24:6f:8c:f1:38:e1), Dst: ASRockIn_9a:ab:d8 (a8:a1:59:9a:ab:d8)
Internet Protocol Version 4, Src: 193.232.148.43, Dst: 192.168.1.40
Transmission Control Protocol, Src Port: 8000, Dst Port: 49171, Seq: 7061, Ack: 1, Len: 1412
Transport Layer Security

No.     Time           Source                Destination           Protocol Length Info
     12 0.221199       192.168.1.40          193.232.148.43        TCP      54     49171 → 8000 [ACK] Seq=1 Ack=8473 Win=1025 Len=0

Frame 12: 54 bytes on wire (432 bits), 54 bytes captured (432 bits) on interface \Device\NPF_{F7DAFAAD-B29B-4F7A-9C1C-178E8F509E7C}, id 0
Ethernet II, Src: ASRockIn_9a:ab:d8 (a8:a1:59:9a:ab:d8), Dst: HuaweiDe_f1:38:e1 (24:6f:8c:f1:38:e1)
Internet Protocol Version 4, Src: 192.168.1.40, Dst: 193.232.148.43
Transmission Control Protocol, Src Port: 49171, Dst Port: 8000, Seq: 1, Ack: 8473, Len: 0

No.     Time           Source                Destination           Protocol Length Info
     13 0.491242       193.232.148.43        192.168.1.40          TLSv1.2  1455   Ignored Unknown Record

Frame 13: 1455 bytes on wire (11640 bits), 1455 bytes captured (11640 bits) on interface \Device\NPF_{F7DAFAAD-B29B-4F7A-9C1C-178E8F509E7C}, id 0
Ethernet II, Src: HuaweiDe_f1:38:e1 (24:6f:8c:f1:38:e1), Dst: ASRockIn_9a:ab:d8 (a8:a1:59:9a:ab:d8)
Internet Protocol Version 4, Src: 193.232.148.43, Dst: 192.168.1.40
Transmission Control Protocol, Src Port: 8000, Dst Port: 49171, Seq: 8473, Ack: 1, Len: 1401
Transport Layer Security

No.     Time           Source                Destination           Protocol Length Info
     14 0.541367       192.168.1.40          193.232.148.43        TCP      54     49171 → 8000 [ACK] Seq=1 Ack=9874 Win=1020 Len=0

Frame 14: 54 bytes on wire (432 bits), 54 bytes captured (432 bits) on interface \Device\NPF_{F7DAFAAD-B29B-4F7A-9C1C-178E8F509E7C}, id 0
Ethernet II, Src: ASRockIn_9a:ab:d8 (a8:a1:59:9a:ab:d8), Dst: HuaweiDe_f1:38:e1 (24:6f:8c:f1:38:e1)
Internet Protocol Version 4, Src: 192.168.1.40, Dst: 193.232.148.43
Transmission Control Protocol, Src Port: 49171, Dst Port: 8000, Seq: 1, Ack: 9874, Len: 0

No.     Time           Source                Destination           Protocol Length Info
     15 0.644903       192.168.1.40          192.168.1.255         UDP      305    54915 → 54915 Len=263

Frame 15: 305 bytes on wire (2440 bits), 305 bytes captured (2440 bits) on interface \Device\NPF_{F7DAFAAD-B29B-4F7A-9C1C-178E8F509E7C}, id 0
Ethernet II, Src: ASRockIn_9a:ab:d8 (a8:a1:59:9a:ab:d8), Dst: Broadcast (ff:ff:ff:ff:ff:ff)
Internet Protocol Version 4, Src: 192.168.1.40, Dst: 192.168.1.255
User Datagram Protocol, Src Port: 54915, Dst Port: 54915
Data (263 bytes)

0000  00 42 49 47 53 54 41 52 00 00 00 00 00 00 00 00   .BIGSTAR........
0010  00 00 00 00 00 00 00 00 a0 70 a9 ae 10 02 00 00   .........p......
0020  00 b8 df fa dd 00 00 00 70 c0 e6 ae 10 02 00 00   ........p.......
0030  33 27 00 00 00 00 00 00 90 70 a9 ae 10 02 00 00   3'.......p......
0040  50 e4 b2 a9 10 02 00 00 c0 bb df fa dd 00 00 00   P...............
0050  c0 bb df fa dd 00 00 00 c6 74 9b 7c fc 7f 00 00   .........t.|....
0060  07 01 00 00 00 00 00 00 e0 b9 df fa dd 00 00 00   ................
0070  90 e3 e2 ae 10 02 00 00 60 f1 d1 ae 10 02 00 00   ........`.......
0080  88 43 5f 7b 31 32 35 34 33 30 36 65 2d 64 62 34   .C_{1254306e-db4
0090  66 2d 34 36 31 33 2d 61 62 31 33 2d 66 30 63 38   f-4613-ab13-f0c8
00a0  61 39 63 37 65 66 65 31 7d 00 b2 a9 10 02 00 00   a9c7efe1}.......
00b0  e0 b9 df fa 1c 00 00 00 00 00 00 00 00 00 00 00   ................
00c0  01 00 00 00 00 00 00 00 80 b8 df fa dd 00 00 00   ................
00d0  00 00 00 00 00 00 00 00 00 00 00 00 00 00 00 00   ................
00e0  00 00 00 00 00 00 00 00 00 00 00 00 10 02 00 00   ................
00f0  eb ba b9 a5 a4 ee 00 00 8a 51 a6 7c fc 7f 00 00   .........Q.|....
0100  07 01 00 1e 1d 15 2b                              ......+

No.     Time           Source                Destination           Protocol Length Info
     16 0.767653       HuaweiDe_f1:38:e1     Spanning-tree-(for-bridges)_00 STP      60     Conf. Root = 28672/0/24:6f:8c:f1:38:e1  Cost = 0  Port = 0x8002

Frame 16: 60 bytes on wire (480 bits), 60 bytes captured (480 bits) on interface \Device\NPF_{F7DAFAAD-B29B-4F7A-9C1C-178E8F509E7C}, id 0
IEEE 802.3 Ethernet 
Logical-Link Control
Spanning Tree Protocol

No.     Time           Source                Destination           Protocol Length Info
     17 0.883487       193.232.148.43        192.168.1.40          TCP      1466   8000 → 49171 [ACK] Seq=9874 Ack=1 Win=66 Len=1412 [TCP segment of a reassembled PDU]

Frame 17: 1466 bytes on wire (11728 bits), 1466 bytes captured (11728 bits) on interface \Device\NPF_{F7DAFAAD-B29B-4F7A-9C1C-178E8F509E7C}, id 0
Ethernet II, Src: HuaweiDe_f1:38:e1 (24:6f:8c:f1:38:e1), Dst: ASRockIn_9a:ab:d8 (a8:a1:59:9a:ab:d8)
Internet Protocol Version 4, Src: 193.232.148.43, Dst: 192.168.1.40
Transmission Control Protocol, Src Port: 8000, Dst Port: 49171, Seq: 9874, Ack: 1, Len: 1412

No.     Time           Source                Destination           Protocol Length Info
     18 0.940912       192.168.1.40          193.232.148.43        TCP      54     49171 → 8000 [ACK] Seq=1 Ack=11286 Win=1025 Len=0

Frame 18: 54 bytes on wire (432 bits), 54 bytes captured (432 bits) on interface \Device\NPF_{F7DAFAAD-B29B-4F7A-9C1C-178E8F509E7C}, id 0
Ethernet II, Src: ASRockIn_9a:ab:d8 (a8:a1:59:9a:ab:d8), Dst: HuaweiDe_f1:38:e1 (24:6f:8c:f1:38:e1)
Internet Protocol Version 4, Src: 192.168.1.40, Dst: 193.232.148.43
Transmission Control Protocol, Src Port: 49171, Dst Port: 8000, Seq: 1, Ack: 11286, Len: 0

No.     Time           Source                Destination           Protocol Length Info
     19 1.033614       193.232.148.43        192.168.1.40          TLSv1.2  1466   Application Data [TCP segment of a reassembled PDU]

Frame 19: 1466 bytes on wire (11728 bits), 1466 bytes captured (11728 bits) on interface \Device\NPF_{F7DAFAAD-B29B-4F7A-9C1C-178E8F509E7C}, id 0
Ethernet II, Src: HuaweiDe_f1:38:e1 (24:6f:8c:f1:38:e1), Dst: ASRockIn_9a:ab:d8 (a8:a1:59:9a:ab:d8)
Internet Protocol Version 4, Src: 193.232.148.43, Dst: 192.168.1.40
Transmission Control Protocol, Src Port: 8000, Dst Port: 49171, Seq: 11286, Ack: 1, Len: 1412
[2 Reassembled TCP Segments (1694 bytes): #17(1412), #19(282)]
Transport Layer Security

No.     Time           Source                Destination           Protocol Length Info
     20 1.081310       192.168.1.40          193.232.148.43        TCP      54     49171 → 8000 [ACK] Seq=1 Ack=12698 Win=1025 Len=0

Frame 20: 54 bytes on wire (432 bits), 54 bytes captured (432 bits) on interface \Device\NPF_{F7DAFAAD-B29B-4F7A-9C1C-178E8F509E7C}, id 0
Ethernet II, Src: ASRockIn_9a:ab:d8 (a8:a1:59:9a:ab:d8), Dst: HuaweiDe_f1:38:e1 (24:6f:8c:f1:38:e1)
Internet Protocol Version 4, Src: 192.168.1.40, Dst: 193.232.148.43
Transmission Control Protocol, Src Port: 49171, Dst Port: 8000, Seq: 1, Ack: 12698, Len: 0

No.     Time           Source                Destination           Protocol Length Info
     21 1.173014       193.232.148.43        192.168.1.40          TLSv1.2  1466   Application Data [TCP segment of a reassembled PDU]

Frame 21: 1466 bytes on wire (11728 bits), 1466 bytes captured (11728 bits) on interface \Device\NPF_{F7DAFAAD-B29B-4F7A-9C1C-178E8F509E7C}, id 0
Ethernet II, Src: HuaweiDe_f1:38:e1 (24:6f:8c:f1:38:e1), Dst: ASRockIn_9a:ab:d8 (a8:a1:59:9a:ab:d8)
Internet Protocol Version 4, Src: 193.232.148.43, Dst: 192.168.1.40
Transmission Control Protocol, Src Port: 8000, Dst Port: 49171, Seq: 12698, Ack: 1, Len: 1412
[2 Reassembled TCP Segments (1694 bytes): #19(1130), #21(564)]
Transport Layer Security

No.     Time           Source                Destination           Protocol Length Info
     22 1.221284       192.168.1.40          193.232.148.43        TCP      54     49171 → 8000 [ACK] Seq=1 Ack=14110 Win=1025 Len=0

Frame 22: 54 bytes on wire (432 bits), 54 bytes captured (432 bits) on interface \Device\NPF_{F7DAFAAD-B29B-4F7A-9C1C-178E8F509E7C}, id 0
Ethernet II, Src: ASRockIn_9a:ab:d8 (a8:a1:59:9a:ab:d8), Dst: HuaweiDe_f1:38:e1 (24:6f:8c:f1:38:e1)
Internet Protocol Version 4, Src: 192.168.1.40, Dst: 193.232.148.43
Transmission Control Protocol, Src Port: 49171, Dst Port: 8000, Seq: 1, Ack: 14110, Len: 0

No.     Time           Source                Destination           Protocol Length Info
     23 1.290566       193.232.148.43        192.168.1.40          TLSv1.2  1466   Application Data [TCP segment of a reassembled PDU]

Frame 23: 1466 bytes on wire (11728 bits), 1466 bytes captured (11728 bits) on interface \Device\NPF_{F7DAFAAD-B29B-4F7A-9C1C-178E8F509E7C}, id 0
Ethernet II, Src: HuaweiDe_f1:38:e1 (24:6f:8c:f1:38:e1), Dst: ASRockIn_9a:ab:d8 (a8:a1:59:9a:ab:d8)
Internet Protocol Version 4, Src: 193.232.148.43, Dst: 192.168.1.40
Transmission Control Protocol, Src Port: 8000, Dst Port: 49171, Seq: 14110, Ack: 1, Len: 1412
[2 Reassembled TCP Segments (1693 bytes): #21(848), #23(845)]
Transport Layer Security

No.     Time           Source                Destination           Protocol Length Info
     24 1.341298       192.168.1.40          193.232.148.43        TCP      54     49171 → 8000 [ACK] Seq=1 Ack=15522 Win=1025 Len=0

Frame 24: 54 bytes on wire (432 bits), 54 bytes captured (432 bits) on interface \Device\NPF_{F7DAFAAD-B29B-4F7A-9C1C-178E8F509E7C}, id 0
Ethernet II, Src: ASRockIn_9a:ab:d8 (a8:a1:59:9a:ab:d8), Dst: HuaweiDe_f1:38:e1 (24:6f:8c:f1:38:e1)
Internet Protocol Version 4, Src: 192.168.1.40, Dst: 193.232.148.43
Transmission Control Protocol, Src Port: 49171, Dst Port: 8000, Seq: 1, Ack: 15522, Len: 0

No.     Time           Source                Destination           Protocol Length Info
     25 1.395731       193.232.148.43        192.168.1.40          TLSv1.2  1466   Application Data [TCP segment of a reassembled PDU]

Frame 25: 1466 bytes on wire (11728 bits), 1466 bytes captured (11728 bits) on interface \Device\NPF_{F7DAFAAD-B29B-4F7A-9C1C-178E8F509E7C}, id 0
Ethernet II, Src: HuaweiDe_f1:38:e1 (24:6f:8c:f1:38:e1), Dst: ASRockIn_9a:ab:d8 (a8:a1:59:9a:ab:d8)
Internet Protocol Version 4, Src: 193.232.148.43, Dst: 192.168.1.40
Transmission Control Protocol, Src Port: 8000, Dst Port: 49171, Seq: 15522, Ack: 1, Len: 1412
[2 Reassembled TCP Segments (1694 bytes): #23(567), #25(1127)]
Transport Layer Security

No.     Time           Source                Destination           Protocol Length Info
     26 1.451241       192.168.1.40          193.232.148.43        TCP      54     49171 → 8000 [ACK] Seq=1 Ack=16934 Win=1025 Len=0

Frame 26: 54 bytes on wire (432 bits), 54 bytes captured (432 bits) on interface \Device\NPF_{F7DAFAAD-B29B-4F7A-9C1C-178E8F509E7C}, id 0
Ethernet II, Src: ASRockIn_9a:ab:d8 (a8:a1:59:9a:ab:d8), Dst: HuaweiDe_f1:38:e1 (24:6f:8c:f1:38:e1)
Internet Protocol Version 4, Src: 192.168.1.40, Dst: 193.232.148.43
Transmission Control Protocol, Src Port: 49171, Dst Port: 8000, Seq: 1, Ack: 16934, Len: 0

No.     Time           Source                Destination           Protocol Length Info
     27 1.488609       193.232.148.43        192.168.1.40          TLSv1.2  1466   Application Data [TCP segment of a reassembled PDU]

Frame 27: 1466 bytes on wire (11728 bits), 1466 bytes captured (11728 bits) on interface \Device\NPF_{F7DAFAAD-B29B-4F7A-9C1C-178E8F509E7C}, id 0
Ethernet II, Src: HuaweiDe_f1:38:e1 (24:6f:8c:f1:38:e1), Dst: ASRockIn_9a:ab:d8 (a8:a1:59:9a:ab:d8)
Internet Protocol Version 4, Src: 193.232.148.43, Dst: 192.168.1.40
Transmission Control Protocol, Src Port: 8000, Dst Port: 49171, Seq: 16934, Ack: 1, Len: 1412
[2 Reassembled TCP Segments (1694 bytes): #25(285), #27(1409)]
Transport Layer Security

No.     Time           Source                Destination           Protocol Length Info
     28 1.488661       193.232.148.43        192.168.1.40          TCP      1466   8000 → 49171 [ACK] Seq=18346 Ack=1 Win=66 Len=1412 [TCP segment of a reassembled PDU]

Frame 28: 1466 bytes on wire (11728 bits), 1466 bytes captured (11728 bits) on interface \Device\NPF_{F7DAFAAD-B29B-4F7A-9C1C-178E8F509E7C}, id 0
Ethernet II, Src: HuaweiDe_f1:38:e1 (24:6f:8c:f1:38:e1), Dst: ASRockIn_9a:ab:d8 (a8:a1:59:9a:ab:d8)
Internet Protocol Version 4, Src: 193.232.148.43, Dst: 192.168.1.40
Transmission Control Protocol, Src Port: 8000, Dst Port: 49171, Seq: 18346, Ack: 1, Len: 1412

No.     Time           Source                Destination           Protocol Length Info
     29 1.488674       192.168.1.40          193.232.148.43        TCP      54     49171 → 8000 [ACK] Seq=1 Ack=19758 Win=1025 Len=0

Frame 29: 54 bytes on wire (432 bits), 54 bytes captured (432 bits) on interface \Device\NPF_{F7DAFAAD-B29B-4F7A-9C1C-178E8F509E7C}, id 0
Ethernet II, Src: ASRockIn_9a:ab:d8 (a8:a1:59:9a:ab:d8), Dst: HuaweiDe_f1:38:e1 (24:6f:8c:f1:38:e1)
Internet Protocol Version 4, Src: 192.168.1.40, Dst: 193.232.148.43
Transmission Control Protocol, Src Port: 49171, Dst Port: 8000, Seq: 1, Ack: 19758, Len: 0

No.     Time           Source                Destination           Protocol Length Info
     30 1.568622       193.232.148.43        192.168.1.40          TLSv1.2  1466   Application Data [TCP segment of a reassembled PDU]

Frame 30: 1466 bytes on wire (11728 bits), 1466 bytes captured (11728 bits) on interface \Device\NPF_{F7DAFAAD-B29B-4F7A-9C1C-178E8F509E7C}, id 0
Ethernet II, Src: HuaweiDe_f1:38:e1 (24:6f:8c:f1:38:e1), Dst: ASRockIn_9a:ab:d8 (a8:a1:59:9a:ab:d8)
Internet Protocol Version 4, Src: 193.232.148.43, Dst: 192.168.1.40
Transmission Control Protocol, Src Port: 8000, Dst Port: 49171, Seq: 19758, Ack: 1, Len: 1412
[3 Reassembled TCP Segments (1694 bytes): #27(3), #28(1412), #30(279)]
Transport Layer Security

No.     Time           Source                Destination           Protocol Length Info
     31 1.611247       192.168.1.40          193.232.148.43        TCP      54     49171 → 8000 [ACK] Seq=1 Ack=21170 Win=1025 Len=0

Frame 31: 54 bytes on wire (432 bits), 54 bytes captured (432 bits) on interface \Device\NPF_{F7DAFAAD-B29B-4F7A-9C1C-178E8F509E7C}, id 0
Ethernet II, Src: ASRockIn_9a:ab:d8 (a8:a1:59:9a:ab:d8), Dst: HuaweiDe_f1:38:e1 (24:6f:8c:f1:38:e1)
Internet Protocol Version 4, Src: 192.168.1.40, Dst: 193.232.148.43
Transmission Control Protocol, Src Port: 49171, Dst Port: 8000, Seq: 1, Ack: 21170, Len: 0

No.     Time           Source                Destination           Protocol Length Info
     32 1.634617       192.168.1.40          192.168.1.255         UDP      305    54915 → 54915 Len=263

Frame 32: 305 bytes on wire (2440 bits), 305 bytes captured (2440 bits) on interface \Device\NPF_{F7DAFAAD-B29B-4F7A-9C1C-178E8F509E7C}, id 0
Ethernet II, Src: ASRockIn_9a:ab:d8 (a8:a1:59:9a:ab:d8), Dst: Broadcast (ff:ff:ff:ff:ff:ff)
Internet Protocol Version 4, Src: 192.168.1.40, Dst: 192.168.1.255
User Datagram Protocol, Src Port: 54915, Dst Port: 54915
Data (263 bytes)

0000  00 42 49 47 53 54 41 52 00 00 00 00 00 00 00 00   .BIGSTAR........
0010  00 00 00 00 00 00 00 00 a0 70 a9 ae 10 02 00 00   .........p......
0020  00 b8 df fa dd 00 00 00 70 c0 e6 ae 10 02 00 00   ........p.......
0030  33 27 00 00 00 00 00 00 90 70 a9 ae 10 02 00 00   3'.......p......
0040  50 e4 b2 a9 10 02 00 00 c0 bb df fa dd 00 00 00   P...............
0050  c0 bb df fa dd 00 00 00 c6 74 9b 7c fc 7f 00 00   .........t.|....
0060  07 01 00 00 00 00 00 00 e0 b9 df fa dd 00 00 00   ................
0070  90 e3 e2 ae 10 02 00 00 60 f1 d1 ae 10 02 00 00   ........`.......
0080  88 44 5f 7b 31 32 35 34 33 30 36 65 2d 64 62 34   .D_{1254306e-db4
0090  66 2d 34 36 31 33 2d 61 62 31 33 2d 66 30 63 38   f-4613-ab13-f0c8
00a0  61 39 63 37 65 66 65 31 7d 00 b2 a9 10 02 00 00   a9c7efe1}.......
00b0  e0 b9 df fa 1c 00 00 00 00 00 00 00 00 00 00 00   ................
00c0  01 00 00 00 00 00 00 00 80 b8 df fa dd 00 00 00   ................
00d0  00 00 00 00 00 00 00 00 00 00 00 00 00 00 00 00   ................
00e0  00 00 00 00 00 00 00 00 00 00 00 00 10 02 00 00   ................
00f0  eb ba b9 a5 a4 ee 00 00 8a 51 a6 7c fc 7f 00 00   .........Q.|....
0100  07 01 00 8a ac 20 87                              ..... .

No.     Time           Source                Destination           Protocol Length Info
     33 1.640478       193.232.148.43        192.168.1.40          TLSv1.2  1466   Application Data [TCP segment of a reassembled PDU]

Frame 33: 1466 bytes on wire (11728 bits), 1466 bytes captured (11728 bits) on interface \Device\NPF_{F7DAFAAD-B29B-4F7A-9C1C-178E8F509E7C}, id 0
Ethernet II, Src: HuaweiDe_f1:38:e1 (24:6f:8c:f1:38:e1), Dst: ASRockIn_9a:ab:d8 (a8:a1:59:9a:ab:d8)
Internet Protocol Version 4, Src: 193.232.148.43, Dst: 192.168.1.40
Transmission Control Protocol, Src Port: 8000, Dst Port: 49171, Seq: 21170, Ack: 1, Len: 1412
[2 Reassembled TCP Segments (1694 bytes): #30(1133), #33(561)]
Transport Layer Security

No.     Time           Source                Destination           Protocol Length Info
     34 1.691303       192.168.1.40          193.232.148.43        TCP      54     49171 → 8000 [ACK] Seq=1 Ack=22582 Win=1025 Len=0

Frame 34: 54 bytes on wire (432 bits), 54 bytes captured (432 bits) on interface \Device\NPF_{F7DAFAAD-B29B-4F7A-9C1C-178E8F509E7C}, id 0
Ethernet II, Src: ASRockIn_9a:ab:d8 (a8:a1:59:9a:ab:d8), Dst: HuaweiDe_f1:38:e1 (24:6f:8c:f1:38:e1)
Internet Protocol Version 4, Src: 192.168.1.40, Dst: 193.232.148.43
Transmission Control Protocol, Src Port: 49171, Dst Port: 8000, Seq: 1, Ack: 22582, Len: 0

No.     Time           Source                Destination           Protocol Length Info
     35 1.711012       193.232.148.43        192.168.1.40          TLSv1.2  1466   Application Data [TCP segment of a reassembled PDU]

Frame 35: 1466 bytes on wire (11728 bits), 1466 bytes captured (11728 bits) on interface \Device\NPF_{F7DAFAAD-B29B-4F7A-9C1C-178E8F509E7C}, id 0
Ethernet II, Src: HuaweiDe_f1:38:e1 (24:6f:8c:f1:38:e1), Dst: ASRockIn_9a:ab:d8 (a8:a1:59:9a:ab:d8)
Internet Protocol Version 4, Src: 193.232.148.43, Dst: 192.168.1.40
Transmission Control Protocol, Src Port: 8000, Dst Port: 49171, Seq: 22582, Ack: 1, Len: 1412
[2 Reassembled TCP Segments (1694 bytes): #33(851), #35(843)]
Transport Layer Security

No.     Time           Source                Destination           Protocol Length Info
     36 1.764221       193.232.148.43        192.168.1.40          TLSv1.2  1466   Application Data [TCP segment of a reassembled PDU]

Frame 36: 1466 bytes on wire (11728 bits), 1466 bytes captured (11728 bits) on interface \Device\NPF_{F7DAFAAD-B29B-4F7A-9C1C-178E8F509E7C}, id 0
Ethernet II, Src: HuaweiDe_f1:38:e1 (24:6f:8c:f1:38:e1), Dst: ASRockIn_9a:ab:d8 (a8:a1:59:9a:ab:d8)
Internet Protocol Version 4, Src: 193.232.148.43, Dst: 192.168.1.40
Transmission Control Protocol, Src Port: 8000, Dst Port: 49171, Seq: 23994, Ack: 1, Len: 1412
[2 Reassembled TCP Segments (1694 bytes): #35(569), #36(1125)]
Transport Layer Security

No.     Time           Source                Destination           Protocol Length Info
     37 1.764254       192.168.1.40          193.232.148.43        TCP      54     49171 → 8000 [ACK] Seq=1 Ack=25406 Win=1025 Len=0

Frame 37: 54 bytes on wire (432 bits), 54 bytes captured (432 bits) on interface \Device\NPF_{F7DAFAAD-B29B-4F7A-9C1C-178E8F509E7C}, id 0
Ethernet II, Src: ASRockIn_9a:ab:d8 (a8:a1:59:9a:ab:d8), Dst: HuaweiDe_f1:38:e1 (24:6f:8c:f1:38:e1)
Internet Protocol Version 4, Src: 192.168.1.40, Dst: 193.232.148.43
Transmission Control Protocol, Src Port: 49171, Dst Port: 8000, Seq: 1, Ack: 25406, Len: 0

No.     Time           Source                Destination           Protocol Length Info
     38 1.819541       193.232.148.43        192.168.1.40          TLSv1.2  1466   Application Data [TCP segment of a reassembled PDU]

Frame 38: 1466 bytes on wire (11728 bits), 1466 bytes captured (11728 bits) on interface \Device\NPF_{F7DAFAAD-B29B-4F7A-9C1C-178E8F509E7C}, id 0
Ethernet II, Src: HuaweiDe_f1:38:e1 (24:6f:8c:f1:38:e1), Dst: ASRockIn_9a:ab:d8 (a8:a1:59:9a:ab:d8)
Internet Protocol Version 4, Src: 193.232.148.43, Dst: 192.168.1.40
Transmission Control Protocol, Src Port: 8000, Dst Port: 49171, Seq: 25406, Ack: 1, Len: 1412
[2 Reassembled TCP Segments (1693 bytes): #36(287), #38(1406)]
Transport Layer Security

No.     Time           Source                Destination           Protocol Length Info
     39 1.819725       193.232.148.43        192.168.1.40          TCP      1466   8000 → 49171 [ACK] Seq=26818 Ack=1 Win=66 Len=1412 [TCP segment of a reassembled PDU]

Frame 39: 1466 bytes on wire (11728 bits), 1466 bytes captured (11728 bits) on interface \Device\NPF_{F7DAFAAD-B29B-4F7A-9C1C-178E8F509E7C}, id 0
Ethernet II, Src: HuaweiDe_f1:38:e1 (24:6f:8c:f1:38:e1), Dst: ASRockIn_9a:ab:d8 (a8:a1:59:9a:ab:d8)
Internet Protocol Version 4, Src: 193.232.148.43, Dst: 192.168.1.40
Transmission Control Protocol, Src Port: 8000, Dst Port: 49171, Seq: 26818, Ack: 1, Len: 1412

No.     Time           Source                Destination           Protocol Length Info
     40 1.819749       192.168.1.40          193.232.148.43        TCP      54     49171 → 8000 [ACK] Seq=1 Ack=28230 Win=1025 Len=0

Frame 40: 54 bytes on wire (432 bits), 54 bytes captured (432 bits) on interface \Device\NPF_{F7DAFAAD-B29B-4F7A-9C1C-178E8F509E7C}, id 0
Ethernet II, Src: ASRockIn_9a:ab:d8 (a8:a1:59:9a:ab:d8), Dst: HuaweiDe_f1:38:e1 (24:6f:8c:f1:38:e1)
Internet Protocol Version 4, Src: 192.168.1.40, Dst: 193.232.148.43
Transmission Control Protocol, Src Port: 49171, Dst Port: 8000, Seq: 1, Ack: 28230, Len: 0

No.     Time           Source                Destination           Protocol Length Info
     41 1.862755       193.232.148.43        192.168.1.40          TLSv1.2  1466   Application Data [TCP segment of a reassembled PDU]

Frame 41: 1466 bytes on wire (11728 bits), 1466 bytes captured (11728 bits) on interface \Device\NPF_{F7DAFAAD-B29B-4F7A-9C1C-178E8F509E7C}, id 0
Ethernet II, Src: HuaweiDe_f1:38:e1 (24:6f:8c:f1:38:e1), Dst: ASRockIn_9a:ab:d8 (a8:a1:59:9a:ab:d8)
Internet Protocol Version 4, Src: 193.232.148.43, Dst: 192.168.1.40
Transmission Control Protocol, Src Port: 8000, Dst Port: 49171, Seq: 28230, Ack: 1, Len: 1412
[3 Reassembled TCP Segments (1694 bytes): #38(6), #39(1412), #41(276)]
Transport Layer Security

No.     Time           Source                Destination           Protocol Length Info
     42 1.901957       193.232.148.43        192.168.1.40          TLSv1.2  1466   Application Data [TCP segment of a reassembled PDU]

Frame 42: 1466 bytes on wire (11728 bits), 1466 bytes captured (11728 bits) on interface \Device\NPF_{F7DAFAAD-B29B-4F7A-9C1C-178E8F509E7C}, id 0
Ethernet II, Src: HuaweiDe_f1:38:e1 (24:6f:8c:f1:38:e1), Dst: ASRockIn_9a:ab:d8 (a8:a1:59:9a:ab:d8)
Internet Protocol Version 4, Src: 193.232.148.43, Dst: 192.168.1.40
Transmission Control Protocol, Src Port: 8000, Dst Port: 49171, Seq: 29642, Ack: 1, Len: 1412
[2 Reassembled TCP Segments (1694 bytes): #41(1136), #42(558)]
Transport Layer Security

No.     Time           Source                Destination           Protocol Length Info
     43 1.902013       192.168.1.40          193.232.148.43        TCP      54     49171 → 8000 [ACK] Seq=1 Ack=31054 Win=1025 Len=0

Frame 43: 54 bytes on wire (432 bits), 54 bytes captured (432 bits) on interface \Device\NPF_{F7DAFAAD-B29B-4F7A-9C1C-178E8F509E7C}, id 0
Ethernet II, Src: ASRockIn_9a:ab:d8 (a8:a1:59:9a:ab:d8), Dst: HuaweiDe_f1:38:e1 (24:6f:8c:f1:38:e1)
Internet Protocol Version 4, Src: 192.168.1.40, Dst: 193.232.148.43
Transmission Control Protocol, Src Port: 49171, Dst Port: 8000, Seq: 1, Ack: 31054, Len: 0

No.     Time           Source                Destination           Protocol Length Info
     44 1.940744       193.232.148.43        192.168.1.40          TLSv1.2  1466   Application Data [TCP segment of a reassembled PDU]

Frame 44: 1466 bytes on wire (11728 bits), 1466 bytes captured (11728 bits) on interface \Device\NPF_{F7DAFAAD-B29B-4F7A-9C1C-178E8F509E7C}, id 0
Ethernet II, Src: HuaweiDe_f1:38:e1 (24:6f:8c:f1:38:e1), Dst: ASRockIn_9a:ab:d8 (a8:a1:59:9a:ab:d8)
Internet Protocol Version 4, Src: 193.232.148.43, Dst: 192.168.1.40
Transmission Control Protocol, Src Port: 8000, Dst Port: 49171, Seq: 31054, Ack: 1, Len: 1412
[2 Reassembled TCP Segments (1694 bytes): #42(854), #44(840)]
Transport Layer Security

No.     Time           Source                Destination           Protocol Length Info
     45 1.965513       193.232.148.43        192.168.1.40          TLSv1.2  1466   Application Data [TCP segment of a reassembled PDU]

Frame 45: 1466 bytes on wire (11728 bits), 1466 bytes captured (11728 bits) on interface \Device\NPF_{F7DAFAAD-B29B-4F7A-9C1C-178E8F509E7C}, id 0
Ethernet II, Src: HuaweiDe_f1:38:e1 (24:6f:8c:f1:38:e1), Dst: ASRockIn_9a:ab:d8 (a8:a1:59:9a:ab:d8)
Internet Protocol Version 4, Src: 193.232.148.43, Dst: 192.168.1.40
Transmission Control Protocol, Src Port: 8000, Dst Port: 49171, Seq: 32466, Ack: 1, Len: 1412
[2 Reassembled TCP Segments (1694 bytes): #44(572), #45(1122)]
Transport Layer Security

No.     Time           Source                Destination           Protocol Length Info
     46 1.965546       192.168.1.40          193.232.148.43        TCP      54     49171 → 8000 [ACK] Seq=1 Ack=33878 Win=1025 Len=0

Frame 46: 54 bytes on wire (432 bits), 54 bytes captured (432 bits) on interface \Device\NPF_{F7DAFAAD-B29B-4F7A-9C1C-178E8F509E7C}, id 0
Ethernet II, Src: ASRockIn_9a:ab:d8 (a8:a1:59:9a:ab:d8), Dst: HuaweiDe_f1:38:e1 (24:6f:8c:f1:38:e1)
Internet Protocol Version 4, Src: 192.168.1.40, Dst: 193.232.148.43
Transmission Control Protocol, Src Port: 49171, Dst Port: 8000, Seq: 1, Ack: 33878, Len: 0

No.     Time           Source                Destination           Protocol Length Info
     47 2.235243       193.232.148.43        192.168.1.40          TLSv1.2  1458   Application Data

Frame 47: 1458 bytes on wire (11664 bits), 1458 bytes captured (11664 bits) on interface \Device\NPF_{F7DAFAAD-B29B-4F7A-9C1C-178E8F509E7C}, id 0
Ethernet II, Src: HuaweiDe_f1:38:e1 (24:6f:8c:f1:38:e1), Dst: ASRockIn_9a:ab:d8 (a8:a1:59:9a:ab:d8)
Internet Protocol Version 4, Src: 193.232.148.43, Dst: 192.168.1.40
Transmission Control Protocol, Src Port: 8000, Dst Port: 49171, Seq: 33878, Ack: 1, Len: 1404
[2 Reassembled TCP Segments (1694 bytes): #45(290), #47(1404)]
Transport Layer Security

No.     Time           Source                Destination           Protocol Length Info
     48 2.286954       193.232.148.43        192.168.1.40          TCP      1466   8000 → 49171 [ACK] Seq=35282 Ack=1 Win=66 Len=1412 [TCP segment of a reassembled PDU]

Frame 48: 1466 bytes on wire (11728 bits), 1466 bytes captured (11728 bits) on interface \Device\NPF_{F7DAFAAD-B29B-4F7A-9C1C-178E8F509E7C}, id 0
